{
  "id": "shared.research.frontier",
  "plugin": "shared.research",
  "display_name": "行业专题研究",
  "entry_nodes": ["scope"],
  "output_nodes": ["persist_knowledge"],
  "nodes": [
    {"id": "scope", "type": "agent", "skill": "research-frontier-markets", "depends_on": [], "permissions": ["knowledge.read"]},
    {"id": "public_research", "type": "tool", "tool": "web.search", "depends_on": ["scope"], "permissions": ["web.read"]},
    {"id": "internal_evidence", "type": "tool", "tool": "knowledge.search", "depends_on": ["public_research"], "permissions": ["knowledge.read"]},
    {"id": "synthesize", "type": "agent", "skill": "research-frontier-markets", "depends_on": ["internal_evidence"], "permissions": ["artifact.write"]},
    {"id": "validate", "type": "validator", "check": "sources_dates_regions_and_fact_labels", "depends_on": ["synthesize"], "permissions": []},
    {"id": "approve_knowledge", "type": "approval", "policy": "owner_confirms_research_knowledge_records", "depends_on": ["validate"], "permissions": []},
    {"id": "persist_knowledge", "type": "tool", "tool": "knowledge.write", "depends_on": ["approve_knowledge"], "permissions": ["knowledge.write"]}
  ]
}
