{
  "id": "market.bidding.outcome-retrospective",
  "plugin": "market.bidding",
  "display_name": "投标结果复盘",
  "entry_nodes": ["load_bid"],
  "output_nodes": ["validate_bid_write"],
  "nodes": [
    {"id": "load_bid", "type": "tool", "tool": "bid.read", "depends_on": [], "permissions": ["bid.read", "sales.read"]},
    {"id": "record_bid_outcome", "type": "agent", "skill": "manage-intelligent-bidding", "depends_on": ["load_bid"], "permissions": []},
    {"id": "approve_bid_data", "type": "approval", "policy": "owner_confirms_outcome_and_lessons", "depends_on": ["record_bid_outcome"], "permissions": []},
    {"id": "write_bid_data", "type": "tool", "tool": "bid.write", "depends_on": ["approve_bid_data"], "permissions": ["bid.write"]},
    {"id": "validate_bid_write", "type": "validator", "check": "outcome_receipt_evidence_and_lessons", "depends_on": ["write_bid_data"], "permissions": []}
  ]
}
