{
  "id": "market.bidding.section-drafting",
  "plugin": "market.bidding",
  "display_name": "标书章节起草",
  "entry_nodes": ["load_bid"],
  "output_nodes": ["validate_bid_write"],
  "nodes": [
    {"id": "load_bid", "type": "tool", "tool": "bid.read", "depends_on": [], "permissions": ["bid.read", "knowledge.read"]},
    {"id": "draft_bid_sections", "type": "agent", "skill": "manage-intelligent-bidding", "depends_on": ["load_bid"], "permissions": ["artifact.write"]},
    {"id": "approve_bid_data", "type": "approval", "policy": "owner_confirms_section_drafts", "depends_on": ["draft_bid_sections"], "permissions": []},
    {"id": "write_bid_data", "type": "tool", "tool": "bid.write", "depends_on": ["approve_bid_data"], "permissions": ["bid.write"]},
    {"id": "validate_bid_write", "type": "validator", "check": "section_versions_facts_and_evidence", "depends_on": ["write_bid_data"], "permissions": []}
  ]
}
