{
  "id": "shared.reporting.weekly-deck-v2",
  "plugin": "shared.weekly-report",
  "display_name": "个性化销售行动简报与总监汇报",
  "entry_nodes": ["collect_week"],
  "output_nodes": ["render_deck"],
  "nodes": [
    {"id": "collect_week", "type": "tool", "tool": "weekly.snapshot", "depends_on": [], "permissions": ["knowledge.read", "sales.read", "task.audit.read", "artifact.read"]},
    {"id": "build_plan", "type": "agent", "skill": "plan-director-presentations", "depends_on": ["collect_week"], "permissions": []},
    {"id": "save_plan", "type": "tool", "tool": "presentation.plan.write", "depends_on": ["build_plan"], "permissions": ["presentation.plan.write"]},
    {"id": "validate_payload", "type": "validator", "check": "weekly_preset_matches_final_plan_and_frozen_deck_payload", "depends_on": ["save_plan"], "permissions": []},
    {"id": "approve", "type": "approval", "policy": "user_confirms_exact_payload_before_artifact_commit", "depends_on": ["validate_payload"], "permissions": []},
    {"id": "render_deck", "type": "tool", "tool": "artifact.deck.write", "depends_on": ["approve"], "permissions": ["artifact.write"]}
  ]
}
