{
  "id": "market.bidding.tender-interpretation",
  "plugin": "market.bidding",
  "display_name": "招标文件解读",
  "entry_nodes": ["load_bid"],
  "output_nodes": ["validate_bid_write"],
  "nodes": [
    {"id": "load_bid", "type": "tool", "tool": "bid.read", "depends_on": [], "permissions": ["bid.read"]},
    {"id": "read_pdf", "type": "tool", "tool": "pdf.read", "depends_on": ["load_bid"], "permissions": ["knowledge.read"]},
    {"id": "interpret_tender", "type": "agent", "skill": "manage-intelligent-bidding", "depends_on": ["read_pdf"], "permissions": ["artifact.write"]},
    {"id": "validate_interpretation", "type": "validator", "check": "requirements_have_document_page_or_paragraph_locator", "depends_on": ["interpret_tender"], "permissions": []},
    {"id": "approve_bid_data", "type": "approval", "policy": "owner_confirms_tender_interpretation", "depends_on": ["validate_interpretation"], "permissions": []},
    {"id": "write_bid_data", "type": "tool", "tool": "bid.write", "depends_on": ["approve_bid_data"], "permissions": ["bid.write"]},
    {"id": "validate_bid_write", "type": "validator", "check": "bid_receipt_and_requirement_versions", "depends_on": ["write_bid_data"], "permissions": []}
  ]
}
